{
  "schema_version": 2,
  "run_id": "kimi-k3-tracelab-p24-d32-cpu-sweep-benchmark-template",
  "simulation_mode": "online",
  "system_architecture": "pd-disaggregation",
  "prefix_cache": {
    "enabled": true,
    "key_mode": "session"
  },
  "cpu_kv_cache": {
    "enabled": true,
    "capacity_bytes": 24000000000000,
    "static_slice_per_gpu": true,
    "capacity_bytes_per_gpu": 1000000000000,
    "dram_bandwidth_gbps_per_gpu": 4800.0,
    "c2c_bandwidth_gbps_per_gpu": 7200.0,
    "write_bandwidth_gbps": 9600.0,
    "write_latency_ms": 0.01,
    "read_bandwidth_gbps": 9600.0,
    "read_latency_ms": 0.01,
    "eviction_policy": "session_lru_suffix",
    "capacity_pressure_policy": "prefix_fit",
    "transfer_concurrency": "full_duplex_serialized"
  },
  "cluster_scheduler": {
    "type": "sticky_round_robin",
    "prefill_type": "cache_aware",
    "decode_type": "vllm_queue_aware",
    "cache_threshold": 0.5,
    "balance_abs_threshold": 8,
    "balance_rel_threshold": 1.5
  },
  "model": "moonshotai/Kimi-K3",
  "clusters": {
    "prefill": {
      "profile": "rubin-vera-24gpu",
      "parallelism": {
        "num_replicas": 1,
        "tensor_parallel_size": 1,
        "decode_context_parallel_size": 1,
        "pipeline_parallel_size": 24,
        "data_parallel_size": 1,
        "moe_tensor_parallel_size": 1,
        "moe_expert_parallel_size": 1,
        "pipeline_exclusive": true
      },
      "scheduler": {
        "type": "vllm_v1",
        "scheduling_policy": "fcfs",
        "batch_size_cap": 256,
        "max_tokens_in_batch": 16384,
        "enable_preemption": true,
        "enable_chunked_prefill": true,
        "long_prefill_token_threshold": 512,
        "block_size": 16,
        "watermark_blocks_fraction": 0.0,
        "num_preallocate_tokens": 0
      },
      "execution_model": {
        "type": "analytical",
        "precision_profile": "kimi-k3-native",
        "moe_layer_event_mode": "stage_group_scaled"
      },
      "moe_routing": {
        "mode": "simulation",
        "distribution": "balanced",
        "seed": 42
      }
    },
    "decode": {
      "profile": "rubin-vera-32gpu",
      "parallelism": {
        "num_replicas": 1,
        "tensor_parallel_size": 4,
        "decode_context_parallel_size": 4,
        "pipeline_parallel_size": 1,
        "data_parallel_size": 8,
        "moe_tensor_parallel_size": 1,
        "moe_expert_parallel_size": 32,
        "pipeline_exclusive": false
      },
      "scheduler": {
        "type": "vllm_v1",
        "scheduling_policy": "fcfs",
        "batch_size_cap": 256,
        "max_tokens_in_batch": 8192,
        "enable_preemption": true,
        "enable_chunked_prefill": false,
        "long_prefill_token_threshold": 0,
        "block_size": 16,
        "watermark_blocks_fraction": 0.0,
        "num_preallocate_tokens": 0
      },
      "execution_model": {
        "type": "analytical",
        "precision_profile": "kimi-k3-native",
        "moe_layer_event_mode": "stage_group_scaled"
      },
      "moe_routing": {
        "mode": "simulation",
        "distribution": "balanced",
        "seed": 42
      }
    }
  },
  "kv_cache_transfer": {
    "link": "rubin-vera-kv",
    "kv_cache_dtype_size_bytes": 1,
    "enable_compression": false
  }
}
