{
  "schema_version": 2,
  "run_id": "kimi-k2-8gpu-hbm500-batch1-128k-plus-1k",
  "simulation_mode": "online",
  "system_architecture": "co-location",
  "prefix_cache": {
    "enabled": true,
    "key_mode": "session"
  },
  "cluster_scheduler": {
    "type": "sticky_round_robin"
  },
  "model": "moonshotai/Kimi-K2-Instruct",
  "clusters": {
    "monolithic": {
      "profile": "rubin-500gb-vera-8gpu",
      "parallelism": {
        "num_replicas": 1,
        "tensor_parallel_size": 1,
        "decode_context_parallel_size": 1,
        "pipeline_parallel_size": 1,
        "data_parallel_size": 8,
        "moe_tensor_parallel_size": 1,
        "moe_expert_parallel_size": 8
      },
      "scheduler": {
        "type": "vllm_v1",
        "scheduling_policy": "fcfs",
        "batch_size_cap": 1,
        "max_tokens_in_batch": 1024,
        "enable_preemption": true,
        "enable_chunked_prefill": true,
        "long_prefill_token_threshold": 1024,
        "block_size": 16,
        "watermark_blocks_fraction": 0.0,
        "num_preallocate_tokens": 0
      },
      "execution_model": {
        "type": "analytical",
        "precision_profile": "kimi-k2-w4a8",
        "moe_layer_event_mode": "first_layer_scaled"
      },
      "moe_routing": {
        "mode": "simulation",
        "distribution": "balanced",
        "seed": 42
      }
    }
  }
}
