{
  "schema_version": 2,
  "run_id": "example-modular-sequential-pdd",
  "simulation_mode": "online",
  "system_architecture": "pd-disaggregation",
  "model": "meta-llama/Llama-2-7b-hf",
  "clusters": {
    "prefill": {
      "profile": "gb300-1gpu",
      "parallelism": {
        "num_replicas": 1,
        "tensor_parallel_size": 1,
        "pipeline_parallel_size": 1,
        "data_parallel_size": 1,
        "moe_tensor_parallel_size": 1,
        "moe_expert_parallel_size": 1
      },
      "scheduler": {
        "type": "vllm_v1",
        "scheduling_policy": "fcfs",
        "batch_size_cap": 8,
        "max_tokens_in_batch": 16,
        "enable_preemption": true,
        "enable_chunked_prefill": true,
        "long_prefill_token_threshold": 0,
        "block_size": 4,
        "num_blocks": 128,
        "watermark_blocks_fraction": 0.0,
        "num_preallocate_tokens": 0
      },
      "execution_model": {
        "type": "fixed",
        "stage_latencies_ms": [0.5]
      }
    },
    "decode": {
      "profile": "gb300-1gpu",
      "parallelism": {
        "num_replicas": 1,
        "tensor_parallel_size": 1,
        "pipeline_parallel_size": 1,
        "data_parallel_size": 1,
        "moe_tensor_parallel_size": 1,
        "moe_expert_parallel_size": 1
      },
      "scheduler": {
        "type": "vllm_v1",
        "scheduling_policy": "fcfs",
        "batch_size_cap": 8,
        "max_tokens_in_batch": 16,
        "enable_preemption": true,
        "enable_chunked_prefill": false,
        "long_prefill_token_threshold": 0,
        "block_size": 4,
        "num_blocks": 128,
        "watermark_blocks_fraction": 0.0,
        "num_preallocate_tokens": 0
      },
      "execution_model": {
        "type": "fixed",
        "stage_latencies_ms": [0.8]
      }
    }
  },
  "kv_cache_transfer": {
    "link": "ib-200g",
    "kv_cache_dtype_size_bytes": 2,
    "enable_compression": false
  }
}
