{
  "schema_version": 2,
  "run_id": "kimi-k3-8gpu-hbm500-tp8-ep8-k2-precision-flashkda-batch16",
  "simulation_mode": "online",
  "system_architecture": "co-location",
  "prefix_cache": { "enabled": true, "key_mode": "session" },
  "cluster_scheduler": { "type": "sticky_round_robin" },
  "model": "moonshotai/Kimi-K3",
  "clusters": {
    "monolithic": {
      "profile": "rubin-500gb-vera-8gpu",
      "parallelism": {
        "num_replicas": 1,
        "tensor_parallel_size": 8,
        "decode_context_parallel_size": 1,
        "pipeline_parallel_size": 1,
        "data_parallel_size": 1,
        "moe_tensor_parallel_size": 1,
        "moe_expert_parallel_size": 8
      },
      "scheduler": {
        "type": "vllm_v1",
        "scheduling_policy": "fcfs",
        "batch_size_cap": 16,
        "max_tokens_in_batch": 16384,
        "enable_preemption": true,
        "enable_chunked_prefill": true,
        "long_prefill_token_threshold": 1024,
        "block_size": 16,
        "watermark_blocks_fraction": 0.0,
        "num_preallocate_tokens": 0
      },
      "execution_model": {
        "type": "analytical",
        "precision": "fp8",
        "operator_precisions": {
          "attention_weight": "fp8",
          "attention_activation": "fp8",
          "dense_mlp_weight": "fp8",
          "dense_mlp_activation": "fp8",
          "routed_expert_weight": "fp4",
          "routed_expert_activation": "fp8",
          "latent_moe_projection_weight": "fp4",
          "latent_moe_projection_activation": "fp8",
          "shared_expert_weight": "fp4",
          "shared_expert_activation": "fp8",
          "router_weight_storage": "fp8",
          "moe_router_activation": "fp8",
          "router_compute": "fp8",
          "lm_head": "fp8",
          "kv_cache": "fp8",
          "kda_snapshot": "fp8"
        },
        "kernel_profile": "k3_flashkda_prefill",
        "moe_layer_event_mode": "stage_group_scaled"
      },
      "moe_routing": { "mode": "simulation", "distribution": "balanced", "seed": 42 }
    }
  }
}
