{
  "schema_version": 2,
  "run_id": "example-modular-dense-analytical",
  "simulation_mode": "online",
  "system_architecture": "co-location",
  "model": "meta-llama/Llama-2-7b-hf",
  "clusters": {
    "monolithic": {
      "profile": "rubin-16gpu",
      "parallelism": {
        "num_replicas": 1,
        "tensor_parallel_size": 4,
        "pipeline_parallel_size": 2,
        "data_parallel_size": 2,
        "moe_tensor_parallel_size": 1,
        "moe_expert_parallel_size": 1
      },
      "scheduler": {
        "type": "vllm_v1",
        "scheduling_policy": "fcfs",
        "batch_size_cap": 8,
        "max_tokens_in_batch": 128,
        "enable_preemption": true,
        "enable_chunked_prefill": true,
        "long_prefill_token_threshold": 0,
        "block_size": 16,
        "num_blocks": 2048,
        "watermark_blocks_fraction": 0.0,
        "num_preallocate_tokens": 0
      },
      "execution_model": {
        "type": "analytical",
        "precision": "fp16"
      }
    }
  }
}
